{
  "$schema": "https://json-schema.org/draft/2020-12/schema",
  "$id": "tpc160-abel-return-v1.schema.json",
  "type": "object",
  "additionalProperties": false,
  "required": [
    "schema",
    "status",
    "hash_mode",
    "upstream",
    "theorem",
    "conditional_promotion",
    "atomic_prefix",
    "finite_certificate",
    "production_status",
    "claim_boundary",
    "checks",
    "mutation_regressions"
  ],
  "properties": {
    "schema": {"const": "tpc-160-abel-return-audit-v1"},
    "status": {"const": "PASS"},
    "hash_mode": {"const": "CANONICAL_UTF8_LF_V2"},
    "upstream": {"type": "object"},
    "theorem": {"type": "object"},
    "conditional_promotion": {"type": "object"},
    "atomic_prefix": {"type": "object"},
    "finite_certificate": {"type": "object"},
    "production_status": {"type": "object"},
    "claim_boundary": {"type": "object"},
    "checks": {"type": "object"},
    "mutation_regressions": {"type": "object"}
  }
}
